stop_id,stop_name,route_id,n_departures,mean_headway,geometry
40435,Southbound Henderson at Harbison,11,68,635,"c(-97.1132984752284, 49.9176555681682)"
40436,Southbound Henderson at Martin,11,68,635,"c(-97.1142668882939, 49.9160432483989)"
40437,Southbound Henderson at Hespeler,11,68,635,"c(-97.1159145924047, 49.9130837298438)"
40443,Southbound Henderson at Dearborn,11,68,635,"c(-97.1169871830145, 49.9116529826629)"
40630,Southbound Henderson at Johnson,11,68,635,"c(-97.1147552550823, 49.914594009626)"
10172,Southbound Osborne at River,18,67,645,"c(-97.146536216832, 49.8791720802764)"
10185,Southbound Osborne at Wardlaw,18,67,645,"c(-97.1441423923714, 49.8769839108007)"
10598,Southbound Osborne at York,18,67,645,"c(-97.150028857977, 49.8879441334443)"
10599,Southbound Osborne at Broadway (Legislature),18,67,645,"c(-97.1499916211998, 49.8856408124199)"
10600,Southbound Osborne at Granite,18,67,645,"c(-97.1488556424479, 49.8833109302037)"
10619,Westbound Graham at Vaughan (The Bay),18,67,645,"c(-97.1490046259873, 49.8906982270866)"
10633,Southbound Main at Alexander,18,67,645,"c(-97.1366735193475, 49.901780157007)"
10634,Southbound Main at James,18,67,645,"c(-97.138042349207, 49.9002280531892)"
10635,Southbound Main at William (City Hall),18,67,645,"c(-97.139077168815, 49.8990303651542)"
10636,Southbound Main at McDermot,18,67,645,"c(-97.1390951696835, 49.8971147159191)"
10840,Southbound Vaughan at St. Mary,18,67,645,"c(-97.1485723111589, 49.8892611056042)"
40428,Southbound Henderson at Kimberly,11,67,645,"c(-97.1039542841493, 49.9278651695059)"
60309,Westbound Corydon at Cambridge West,18,67,645,"c(-97.1755664715825, 49.8630914130568)"
60312,Westbound Corydon at Thurso,18,67,645,"c(-97.1720005261211, 49.864663253276)"
60313,Westbound Corydon at Rockwood,18,67,645,"c(-97.170506315682, 49.8651703531049)"
10068,Southbound Pembina at Osborne Junction,18,66,655,"c(-97.142801343363, 49.8745697200658)"
10125,Westbound Corydon at Harrow,18,66,655,"c(-97.1635443561236, 49.8674797708011)"
10127,Westbound Corydon at Stafford,18,66,655,"c(-97.1612751230575, 49.8682353089511)"
10129,Westbound Corydon at Wentworth,18,66,655,"c(-97.1592456811864, 49.8689046659203)"
10140,Westbound Corydon at Lilac,18,66,655,"c(-97.1570465433708, 49.8696432459632)"
10142,Westbound Corydon at Arbuthnot,18,66,655,"c(-97.1554821402087, 49.8701580296916)"
10144,Westbound Corydon at Cockburn,18,66,655,"c(-97.153226567879, 49.8709136280827)"
10146,Westbound Corydon at Hugo,18,66,655,"c(-97.1512108143922, 49.8715830628758)"
10148,Westbound Corydon at Daly,18,66,655,"c(-97.1485744022166, 49.8724674129699)"
10149,Westbound Corydon at Nassau,18,66,655,"c(-97.1462341271098, 49.8732485056817)"
10612,Westbound Graham at Garry (Wpg Square),18,66,655,"c(-97.1397902750134, 49.8927992825583)"
10614,Westbound Graham at Donald (Canada Life Centre),18,66,655,"c(-97.1424729202096, 49.8921947176353)"
10617,Westbound Graham at Edmonton (RWB),18,66,655,"c(-97.1464477190167, 49.8912959615501)"
10632,Southbound Main at Henry,18,66,655,"c(-97.1353714184405, 49.9034052795095)"
10638,Southbound Main at Pioneer,18,66,655,"c(-97.1379175683709, 49.8940644580607)"
30048,Southbound Main at McAdam,18,66,655,"c(-97.1229966083229, 49.9297945375172)"
30054,Southbound Main at Inkster,18,66,655,"c(-97.1241930270107, 49.9276911095213)"
30057,Southbound Main at Polson,18,66,655,"c(-97.124912013226, 49.9263984820937)"
30071,Southbound Main at Cathedral,18,66,655,"c(-97.1262127009522, 49.9241168215983)"
30073,Southbound Main at Church,18,66,655,"c(-97.1275804422327, 49.9218991955882)"
30077,Southbound Main at Mountain,18,66,655,"c(-97.129308308334, 49.9197323473916)"
30080,Southbound Main at College,18,66,655,"c(-97.1303615205094, 49.918436090383)"
30083,Southbound Main at Redwood,18,66,655,"c(-97.1310635143257, 49.9175749096561)"
30086,Southbound Main at Alfred,18,66,655,"c(-97.1319136844883, 49.9157626458248)"
30088,Southbound Main at Magnus,18,66,655,"c(-97.1322212393746, 49.9142924279887)"
30091,Southbound Main at Selkirk,18,66,655,"c(-97.1328443409524, 49.9118648331989)"
30094,Southbound Main at Dufferin,18,66,655,"c(-97.1336593993288, 49.9087926886057)"
30096,Southbound Main at Jarvis,18,66,655,"c(-97.1339898327914, 49.9074487638606)"
30913,Southbound Main at Stella,18,66,655,"c(-97.1333351938043, 49.9099748025334)"
60315,Westbound Corydon at Wilton,18,66,655,"c(-97.1677583147575, 49.8660803605201)"
60318,Westbound Corydon at Guelph,18,66,655,"c(-97.1656866459656, 49.8667671518188)"
30043,Southbound Main at Jefferson,18,65,665,"c(-97.1209552392437, 49.9331975114989)"
30046,Southbound Main at Rupertsland,18,65,665,"c(-97.1219940540717, 49.9315682830231)"
60369,Westbound Corydon at Waverley,18,65,665,"c(-97.1784011111661, 49.8631990229194)"
60370,Eastbound Corydon at Waverley,18,65,665,"c(-97.177992358593, 49.8629677136876)"
60371,Westbound Corydon at Elm,18,65,665,"c(-97.1810553120686, 49.8632947327232)"
60372,Eastbound Corydon at Elm,18,65,665,"c(-97.1813273093143, 49.8630921209854)"
60373,Westbound Corydon at Ash,18,65,665,"c(-97.1831535814253, 49.8633726617459)"
60374,Eastbound Corydon at Ash,18,65,665,"c(-97.1834398146296, 49.8631612734905)"
60375,Westbound Corydon at Niagara,18,65,665,"c(-97.1856270122957, 49.8634654287731)"
60376,Eastbound Corydon at Niagara,18,65,665,"c(-97.1861771318348, 49.8632671648515)"
60377,Eastbound Corydon at Brock,18,65,665,"c(-97.1880254202128, 49.8633320927712)"
60378,Westbound Corydon at Brock,18,65,665,"c(-97.1891150010668, 49.8635920094807)"
60379,Westbound Corydon at Campbell,18,65,665,"c(-97.1909904497206, 49.8636753047813)"
60380,Eastbound Corydon at Campbell,18,65,665,"c(-97.1912905581567, 49.8634641140542)"
60381,Westbound Corydon at Lindsay,18,65,665,"c(-97.1937559669021, 49.8637724618506)"
60382,Eastbound Corydon at Lindsay,18,65,665,"c(-97.19405606408, 49.8635612638109)"
60383,Westbound Corydon at Lanark,18,65,665,"c(-97.1977579056877, 49.8639247898053)"
60384,Eastbound Corydon at Lanark,18,65,665,"c(-97.1982801678775, 49.8637260346735)"
60385,Westbound Corydon at Centennial,18,65,665,"c(-97.2011065614075, 49.8640578333547)"
60386,Eastbound Corydon at Centennial,18,65,665,"c(-97.2014062949556, 49.8638556057081)"
60387,Westbound Corydon at Lockwood,18,65,665,"c(-97.2027741102393, 49.8641197159045)"
60388,Eastbound Corydon at Lockwood,18,65,665,"c(-97.2031711886106, 49.8639189950473)"
60436,Westbound Corydon at Kenaston,18,65,665,"c(-97.2055807398869, 49.8642352177097)"
60438,Southbound Kenaston at Lockston,18,65,665,"c(-97.205947260735, 49.8659859300566)"
60439,Southbound Kenaston at Tuxedo South,18,65,665,"c(-97.2057627162499, 49.8679619706171)"
60442,Eastbound Tuxedo at Kenaston,18,65,665,"c(-97.2057216591362, 49.869445509473)"
60453,Eastbound Tuxedo at Doncaster,18,65,665,"c(-97.2078894583062, 49.8695330599949)"
60455,Westbound Corydon at Ubique,18,65,665,"c(-97.2076369789779, 49.8646988349056)"
60457,Westbound Corydon at Doncaster,18,65,665,"c(-97.2089891706797, 49.8657631845424)"
60458,Westbound Corydon at Edgeland,18,65,665,"c(-97.2116183584531, 49.8665414234867)"
60691,Eastbound Corydon at Carpathia,18,65,665,"c(-97.2046301257454, 49.8639776124012)"
60458,Westbound Corydon at Edgeland,18,64,675,"c(-97.2116183584531, 49.8665414234867)"
60460,Westbound Corydon at Southport,18,64,675,"c(-97.2143281291376, 49.8666462203808)"
60720,Northbound Tuxedo at Girton,18,64,675,"c(-97.2143323930617, 49.8676627207588)"
60780,Eastbound Tuxedo at Edgeland,18,64,675,"c(-97.2104185685848, 49.8696351509375)"
20239,Eastbound Portage at Westwood,21,61,708,"c(-97.2927779503262, 49.8815019786193)"
20255,Eastbound Portage at Muriel,21,61,708,"c(-97.2969164455469, 49.8821745789933)"
20256,Eastbound Portage at Parkdale,21,61,708,"c(-97.2945632306416, 49.8817981355173)"
20257,Eastbound Portage at Banting,21,61,708,"c(-97.2886794048548, 49.8808837893367)"
20258,Eastbound Portage at Daer,21,61,708,"c(-97.2872815262374, 49.8806562367938)"
20259,Eastbound Portage at Golf,21,61,708,"c(-97.2857445343253, 49.8804266076794)"
20260,Eastbound Portage at Country Club,21,61,708,"c(-97.2832251837456, 49.880029482582)"
20261,Eastbound Portage at Woodlands,21,61,708,"c(-97.2802625950263, 49.8795717500875)"
60027,Northbound Pembina at De Vos,BLUE,61,708,"c(-97.1565689836143, 49.7801433498573)"
60093,Northbound Pembina at Fairfield,BLUE,61,708,"c(-97.1570430837277, 49.7980332694116)"
60095,Northbound Pembina at Chancellor Matheson,BLUE,61,708,"c(-97.1568733051621, 49.8017725426966)"
60116,Northbound Pembina at Chancellor Matheson North,BLUE,61,708,"c(-97.1565995209301, 49.8031264464806)"
60120,Northbound Pembina at Dartmouth,BLUE,61,708,"c(-97.1550856115542, 49.8060257352)"
60124,Westbound Markham at Pembina,BLUE,61,708,"c(-97.1547038826876, 49.8087541674918)"
61216,Northbound Southwest Transitway at Markham Station,BLUE,61,708,"c(-97.1573896553598, 49.8086710373077)"
60029,Northbound Pembina at Dalhousie South,BLUE,60,720,"c(-97.1567031958436, 49.7820974392774)"
60031,Northbound Pembina at Newdale,BLUE,60,720,"c(-97.1568352652825, 49.7844742663177)"
60032,Northbound Pembina at Newdale North,BLUE,60,720,"c(-97.15697849988, 49.7869232313915)"
60059,Northbound Pembina at Cloutier South,BLUE,60,720,"c(-97.1562113272695, 49.7734632327144)"
60066,Northbound Pembina at Greencrest,BLUE,60,720,"c(-97.1572495454994, 49.7925944951932)"
60069,Northbound Pembina at Dalhousie North,BLUE,60,720,"c(-97.1571468343533, 49.7953003984587)"
60656,Northbound Pembina at Killarney North,BLUE,60,720,"c(-97.1572608746806, 49.7908316262328)"
61104,Northbound Pembina at Killarney,BLUE,60,720,"c(-97.1571204840408, 49.7890393546852)"
62004,Northbound Pembina at De La Digue,BLUE,60,720,"c(-97.1546628688193, 49.7666921555216)"
62005,Northbound Pembina at Ducharme,BLUE,60,720,"c(-97.1564157890925, 49.7688069883184)"
62006,Northbound Pembina at Grandmont,BLUE,60,720,"c(-97.1565298526054, 49.7712914760449)"
40182,Westbound Regent at Peguis,47,58,745,"c(-97.0540387365887, 49.8957880521397)"
40154,Westbound Regent at Bienvenu,47,57,758,"c(-97.030843649241, 49.8953597760152)"
40155,Eastbound Regent at Bienvenu,47,57,758,"c(-97.0313833936802, 49.8950991041741)"
40158,Westbound Regent at Bradley,47,57,758,"c(-97.0350478086445, 49.8953862511684)"
40162,Westbound Regent at Owen East,47,57,758,"c(-97.0384445387755, 49.8954078870267)"
40170,Westbound Regent at Owen,47,57,758,"c(-97.0422590915649, 49.8954274957291)"
40174,Westbound Regent at Club Regent (Park & Ride),47,57,758,"c(-97.0450296530448, 49.8954383446065)"
40179,Westbound Regent at Peguis East,47,57,758,"c(-97.051516293665, 49.8954937537786)"
40186,Westbound Regent at Kildonan Place (Park & Ride),47,57,758,"c(-97.0595267032398, 49.896788690844)"
40263,Eastbound Nairn at Keenleyside,47,57,758,"c(-97.0802597828078, 49.9003276574833)"
40287,Eastbound Nairn at Kent,47,57,758,"c(-97.0841733239825, 49.901022149341)"
40322,Eastbound Nairn at Chester,47,57,758,"c(-97.0890687150591, 49.901894631326)"
40771,Eastbound Regent at Chrislind,47,57,758,"c(-97.0287941239739, 49.8950820200164)"
40772,Westbound Regent at Chrislind,47,57,758,"c(-97.0280734716863, 49.8953395977312)"
40800,Westbound Regent at Rougeau,47,57,758,"c(-97.0574256085087, 49.8964026391446)"
10068,Southbound Pembina at Osborne Junction,60,56,771,"c(-97.142801343363, 49.8745697200658)"
10070,Southbound Pembina at Warsaw,60,56,771,"c(-97.1439904024145, 49.8718722879166)"
10072,Southbound Pembina at Fleet,60,56,771,"c(-97.1451631394973, 49.8695973488696)"
10075,Southbound Pembina at Scotland,60,56,771,"c(-97.1471751441484, 49.8657527058665)"
10078,Southbound Pembina at Grant,60,56,771,"c(-97.1477898943185, 49.8642333855791)"
10079,Southbound Pembina at Arbuthnot,60,56,771,"c(-97.1488276429822, 49.8625679119663)"
10081,Southbound Pembina at Ebby,60,56,771,"c(-97.1499216299398, 49.8608853377514)"
10086,Southbound Pembina at Stafford,60,56,771,"c(-97.1522724267656, 49.8568931030367)"
10157,Eastbound Mayfair at Queen Elizabeth,47,56,771,"c(-97.1331202124249, 49.8845154204047)"
10159,Southbound Queen Elizabeth at Stradbrook,47,56,771,"c(-97.1320857490975, 49.8839050593692)"
10185,Southbound Osborne at Wardlaw,60,56,771,"c(-97.1441423923714, 49.8769839108007)"
10351,Eastbound Higgins at Point Douglas,47,56,771,"c(-97.1154006467306, 49.9023263108415)"
10352,Westbound Higgins at Boyle,47,56,771,"c(-97.1157920930009, 49.902287707614)"
10354,Eastbound Higgins at McArthur,47,56,771,"c(-97.1170378489802, 49.9017682752525)"
10355,Eastbound Higgins at Acores,47,56,771,"c(-97.1200585964067, 49.9021591806565)"
10356,Westbound Higgins at Acores,47,56,771,"c(-97.1196226049712, 49.9022690350225)"
10358,Eastbound Higgins at Annabella,47,56,771,"c(-97.1221904008507, 49.902490615714)"
10360,Eastbound Higgins at Waterfront,47,56,771,"c(-97.1269394807812, 49.9035659988189)"
10368,Eastbound Higgins at Maple,47,56,771,"c(-97.1315585974506, 49.9040454168842)"
10614,Westbound Graham at Donald (Canada Life Centre),60,56,771,"c(-97.1424729202096, 49.8921947176353)"
10617,Westbound Graham at Edmonton (RWB),60,56,771,"c(-97.1464477190167, 49.8912959615501)"
10619,Westbound Graham at Vaughan (The Bay),60,56,771,"c(-97.1490046259873, 49.8906982270866)"
10624,Northbound Main at Assiniboine,47,56,771,"c(-97.1334895269339, 49.886851091144)"
10625,Northbound Main at Broadway (Union Station),47,56,771,"c(-97.1348586067014, 49.8892568426911)"
10627,Northbound Main at Pioneer,47,56,771,"c(-97.1378993030511, 49.8949007013879)"
10628,Northbound Main at McDermot,47,56,771,"c(-97.1385990236253, 49.8969808091659)"
10629,Northbound Main at James (Concert Hall),47,56,771,"c(-97.1378182161232, 49.8999006275648)"
10631,Northbound Main at Higgins,47,56,771,"c(-97.1344049171044, 49.9042712198666)"
10638,Southbound Main at Pioneer,47,56,771,"c(-97.1379175683709, 49.8940644580607)"
10639,Southbound Main at St. Mary,47,56,771,"c(-97.1364347461512, 49.8913510839737)"
10641,Southbound Main at Broadway (Union Station),47,56,771,"c(-97.1347440192245, 49.8882565476378)"
10648,Southbound Garry at Portage North,60,56,771,"c(-97.1413016525729, 49.8947754787521)"
10649,Southbound Garry at Portage South,60,56,771,"c(-97.1409118192741, 49.8940496173533)"
10650,Southbound Garry at Graham,60,56,771,"c(-97.1402216442148, 49.892806213489)"
10808,Southbound Pembina at Taylor,60,56,771,"c(-97.1511120126738, 49.8588624806498)"
10840,Southbound Vaughan at St. Mary,60,56,771,"c(-97.1485723111589, 49.8892611056042)"
11027,Southbound Southwest Transitway at Harkness Station,47,56,771,"c(-97.1354506707884, 49.8807570744673)"
11029,Southbound Southwest Transitway at Osborne Station,47,56,771,"c(-97.1410970220562, 49.8732830550562)"
11033,Southbound Southwest Transitway at Jubilee Station,47,56,771,"c(-97.1503147451873, 49.8556924745347)"
11050,Southbound Southwest Transitway at Jubilee Overpass,47,56,771,"c(-97.1508001710452, 49.8539102129978)"
11051,Northbound Main at St. Mary,47,56,771,"c(-97.1361965270918, 49.8917520250686)"
30100,Westbound Higgins at Sutherland,47,56,771,"c(-97.1149214455546, 49.9039016340868)"
30101,Eastbound Higgins at Sutherland,47,56,771,"c(-97.114656300209, 49.9039153063194)"
40159,Eastbound Regent at Bradley,47,56,771,"c(-97.0372576921273, 49.8951448987572)"
40171,Eastbound Regent at Owen,47,56,771,"c(-97.0404314038641, 49.895171689154)"
40175,Eastbound Regent at Starlight,47,56,771,"c(-97.0457637714258, 49.8951898838479)"
40178,Eastbound Regent at Peguis East,47,56,771,"c(-97.0509002518679, 49.8952315187992)"
40183,Eastbound Regent at Peguis,47,56,771,"c(-97.0547681163088, 49.8956563908515)"
40187,Eastbound Regent at Rougeau,47,56,771,"c(-97.0581410734574, 49.8962707230088)"
40190,Eastbound Regent at Lagimodiere,47,56,771,"c(-97.0666170375905, 49.8977708672607)"
40196,Eastbound Regent at Stapon,47,56,771,"c(-97.0635474895355, 49.8972248260648)"
40210,Eastbound Regent at Panet East,47,56,771,"c(-97.0706129440447, 49.8984851872433)"
40230,Eastbound Nairn at Panet West,47,56,771,"c(-97.0735160180683, 49.8990192739556)"
40337,Eastbound Nairn at Grey,47,56,771,"c(-97.0951266423763, 49.9029569463087)"
40445,Eastbound Nairn at Stadacona,47,56,771,"c(-97.1114337977294, 49.9061924930594)"
40446,Eastbound Nairn at Desalaberry,47,56,771,"c(-97.1079885830599, 49.9052547244379)"
40447,Eastbound Nairn at Watt,47,56,771,"c(-97.105554079934, 49.9048281237043)"
40470,Westbound Nairn at Stadacona,47,56,771,"c(-97.1122573425253, 49.9065027610578)"
40768,Eastbound Nairn at Stapleton,47,56,771,"c(-97.0765825820262, 49.8996459546867)"
40786,"Northbound Kildonan Place Terminal at Kildonan Place (47, 86, 87, 92)",47,56,771,"c(-97.0595464523906, 49.8973377223433)"
60096,Eastbound Chancellor Matheson at Pembina,60,56,771,"c(-97.1554975958546, 49.8017686098263)"
60107,Southbound University at Dysart,47,56,771,"c(-97.1412569946502, 49.8085479267308)"
60107,Southbound University at Dysart,BLUE,56,771,"c(-97.1412569946502, 49.8085479267308)"
60110,Southbound University at Markham,47,56,771,"c(-97.1454494762376, 49.8115925908548)"
60112,Southbound University at Thatcher,47,56,771,"c(-97.1473004179687, 49.8151753185579)"
60113,Southbound University at Wedgewood,47,56,771,"c(-97.1490819794778, 49.8169398892219)"
60118,Southbound Pembina at Dartmouth (Victoria Hospital),60,56,771,"c(-97.1552467070264, 49.8065410262425)"
60123,Southbound Pembina at Markham,60,56,771,"c(-97.1537909069306, 49.8093692626937)"
60125,Southbound Pembina at Southpark South,60,56,771,"c(-97.1532365542475, 49.8104218412578)"
60128,Southbound Pembina at Southpark (Park & Ride),60,56,771,"c(-97.1526084676691, 49.8119499815618)"
60130,Southbound Pembina at Thatcher,60,56,771,"c(-97.1522679736598, 49.813590652593)"
60131,Southbound Pembina at Chancellor,60,56,771,"c(-97.1519291674634, 49.8151863736542)"
60138,Southbound Pembina at University Crescent,47,56,771,"c(-97.1525492367646, 49.8178858160822)"
60138,Southbound Pembina at University Crescent,60,56,771,"c(-97.1525492367646, 49.8178858160822)"
60139,Southbound University at Pembina,47,56,771,"c(-97.1511476833094, 49.817818454963)"
60144,Southbound Pembina at Plaza,60,56,771,"c(-97.1529857805182, 49.8221204886533)"
60148,Southbound Pembina at Adamar,60,56,771,"c(-97.1530689881206, 49.8243166234682)"
60150,Southbound Pembina at Adamar North,60,56,771,"c(-97.1528299364162, 49.8254821717335)"
60151,Southbound Pembina at Manahan South,47,56,771,"c(-97.1524838622868, 49.8272666729468)"
60151,Southbound Pembina at Manahan South,60,56,771,"c(-97.1524838622868, 49.8272666729468)"
60154,Southbound Pembina at Manahan,47,56,771,"c(-97.1521615929529, 49.828790694898)"
60154,Southbound Pembina at Manahan,60,56,771,"c(-97.1521615929529, 49.828790694898)"
60155,Southbound Pembina at Chevrier,47,56,771,"c(-97.1509892441769, 49.8325499110286)"
60155,Southbound Pembina at Chevrier,60,56,771,"c(-97.1509892441769, 49.8325499110286)"
60239,Southbound Pembina at Clarence,47,56,771,"c(-97.1510545865503, 49.8366707086759)"
60239,Southbound Pembina at Clarence,60,56,771,"c(-97.1510545865503, 49.8366707086759)"
60243,Southbound Pembina at Waller,47,56,771,"c(-97.1521088303718, 49.8392961235045)"
60243,Southbound Pembina at Waller,60,56,771,"c(-97.1521088303718, 49.8392961235045)"
60246,Southbound Pembina at McGillivray,47,56,771,"c(-97.1532365443888, 49.8407263533593)"
60246,Southbound Pembina at McGillivray,60,56,771,"c(-97.1532365443888, 49.8407263533593)"
60248,Southbound Pembina at Southwood,47,56,771,"c(-97.153569303934, 49.8429444533729)"
60249,Southbound Pembina at North Drive,47,56,771,"c(-97.1533549907868, 49.8456485529017)"
60251,Southbound Pembina at Windermere,47,56,771,"c(-97.1531445644625, 49.8478849691517)"
60251,Southbound Pembina at Windermere,60,56,771,"c(-97.1531445644625, 49.8478849691517)"
60259,Southbound Pembina at Calrossie,47,56,771,"c(-97.1529219264587, 49.8500762140775)"
60259,Southbound Pembina at Calrossie,60,56,771,"c(-97.1529219264587, 49.8500762140775)"
60718,Southbound Pembina at Royse,47,56,771,"c(-97.1505239693894, 49.8345393875239)"
60718,Southbound Pembina at Royse,60,56,771,"c(-97.1505239693894, 49.8345393875239)"
61113,Southbound Research at Chancellor Matheson,60,56,771,"c(-97.1495316573338, 49.8033284534094)"
61114,Eastbound Innovation at Research,60,56,771,"c(-97.1469199225217, 49.8029358426491)"
61115,Eastbound Innovation at RH Way,60,56,771,"c(-97.1431821395582, 49.8043691113883)"
61116,Eastbound Dafoe at University,60,56,771,"c(-97.1391680580052, 49.8057528405553)"
61218,Eastbound Bohemier at University Crescent,BLUE,56,771,"c(-97.1428099443051, 49.8093734312131)"
61253,Eastbound Dafoe at Agriculture,47,56,771,"c(-97.1360707921569, 49.8067824031146)"
61253,Eastbound Dafoe at Agriculture,60,56,771,"c(-97.1360707921569, 49.8067824031146)"
61253,Eastbound Dafoe at Agriculture,BLUE,56,771,"c(-97.1360707921569, 49.8067824031146)"
61254,Eastbound Dafoe at U of M Station,47,56,771,"c(-97.1307197191785, 49.8085850555885)"
61254,Eastbound Dafoe at U of M Station,60,56,771,"c(-97.1307197191785, 49.8085850555885)"
61254,Eastbound Dafoe at U of M Station,BLUE,56,771,"c(-97.1307197191785, 49.8085850555885)"
10066,Northbound Osborne at Osborne Junction,60,55,785,"c(-97.1422927629087, 49.8751282467799)"
10071,Northbound Pembina at Nassau,60,55,785,"c(-97.1438840520329, 49.8710160528182)"
10171,Northbound Osborne at River,60,55,785,"c(-97.1464970340353, 49.8794682890838)"
10172,Southbound Osborne at River,60,55,785,"c(-97.146536216832, 49.8791720802764)"
10186,Northbound Osborne at Stradbrook,60,55,785,"c(-97.1445895101974, 49.8776657066494)"
10353,Westbound Higgins at Maple,47,55,785,"c(-97.1311365321656, 49.9041555394378)"
10357,Westbound Higgins at Annabella,47,55,785,"c(-97.1219760487171, 49.902631058973)"
10359,Westbound Higgins at Waterfront,47,55,785,"c(-97.1265313278086, 49.9036763296592)"
10363,Westbound Higgins at Main,47,55,785,"c(-97.1333815882598, 49.904443619972)"
10598,Southbound Osborne at York,60,55,785,"c(-97.150028857977, 49.8879441334443)"
10599,Southbound Osborne at Broadway (Legislature),60,55,785,"c(-97.1499916211998, 49.8856408124199)"
10600,Southbound Osborne at Granite,60,55,785,"c(-97.1488556424479, 49.8833109302037)"
10611,Eastbound Graham at Fort (Wpg Square),60,55,785,"c(-97.1389651327036, 49.8928939605613)"
10615,Eastbound Graham at Smith,60,55,785,"c(-97.1415215219745, 49.8923143729577)"
10616,Eastbound Graham at Hargrave,60,55,785,"c(-97.1441345452964, 49.8917086518378)"
10618,Eastbound Graham at Edmonton (RWB),60,55,785,"c(-97.1467325568193, 49.8911296165296)"
10630,Northbound Main at Logan,47,55,785,"c(-97.1357599170648, 49.9023591196438)"
10632,Southbound Main at Henry,47,55,785,"c(-97.1353714184405, 49.9034052795095)"
10633,Southbound Main at Alexander,47,55,785,"c(-97.1366735193475, 49.901780157007)"
10634,Southbound Main at James,47,55,785,"c(-97.138042349207, 49.9002280531892)"
10635,Southbound Main at William (City Hall),47,55,785,"c(-97.139077168815, 49.8990303651542)"
10636,Southbound Main at McDermot,47,55,785,"c(-97.1390951696835, 49.8971147159191)"
10644,Northbound Fort at Graham North,60,55,785,"c(-97.139167196099, 49.8941565120558)"
10646,Northbound Fort at Portage,60,55,785,"c(-97.1394776584325, 49.8947731636061)"
10648,Southbound Garry at Portage North,60,55,785,"c(-97.1413016525729, 49.8947754787521)"
11028,Northbound Southwest Transitway at Harkness Station,47,55,785,"c(-97.1349015350505, 49.8809191335515)"
11030,Northbound Southwest Transitway at Osborne Station,47,55,785,"c(-97.1407239809596, 49.8735739001523)"
11031,Southbound Southwest Transitway at Fort Rouge Station,47,55,785,"c(-97.1457723432188, 49.8624110649618)"
11032,Northbound Southwest Transitway at Fort Rouge Station,47,55,785,"c(-97.14509636033, 49.8629849125128)"
40189,Westbound Regent at Stapon East,47,55,785,"c(-97.0618358485511, 49.8971961781537)"
40195,Westbound Regent at Stapon,47,55,785,"c(-97.0641036460439, 49.8975939324106)"
40209,Westbound Regent at Panet East,47,55,785,"c(-97.0710442812658, 49.8988431840599)"
40229,Westbound Nairn at Panet West,47,55,785,"c(-97.0731734300268, 49.8992294535)"
40262,Westbound Nairn at Keenleyside,47,55,785,"c(-97.0797416483733, 49.9004000189353)"
40286,Westbound Nairn at Kent,47,55,785,"c(-97.0843603293786, 49.9012231355521)"
40314,Westbound Nairn at Chester,47,55,785,"c(-97.0883842781984, 49.9019462960554)"
40336,Westbound Nairn at Grey,47,55,785,"c(-97.0954657343122, 49.9031874018748)"
40448,Westbound Nairn at Watt,47,55,785,"c(-97.1049531263624, 49.9048812529663)"
40471,Westbound Nairn at Allan,47,55,785,"c(-97.1084662351948, 49.9055053958934)"
40756,Westbound Nairn at Stapleton,47,55,785,"c(-97.0756498129319, 49.8996394467124)"
40790,Westbound Regent at Lagimodiere,47,55,785,"c(-97.0668827827264, 49.8980901335304)"
60115,Southbound Pembina at Bison North,60,55,785,"c(-97.1569426629228, 49.803239854575)"
60144,Southbound Pembina at Plaza,47,55,785,"c(-97.1529857805182, 49.8221204886533)"
60148,Southbound Pembina at Adamar,47,55,785,"c(-97.1530689881206, 49.8243166234682)"
60150,Southbound Pembina at Adamar North,47,55,785,"c(-97.1528299364162, 49.8254821717335)"
60248,Southbound Pembina at Southwood,60,55,785,"c(-97.153569303934, 49.8429444533729)"
60249,Southbound Pembina at North Drive,60,55,785,"c(-97.1533549907868, 49.8456485529017)"
60257,Northbound Pembina at Calrossie,47,55,785,"c(-97.1525115012983, 49.8495299587968)"
60260,Northbound Pembina at Merriam,47,55,785,"c(-97.1522153114121, 49.8507305700258)"
61215,Eastbound Southpark at Southpark Station,BLUE,55,785,"c(-97.1539507092161, 49.810649120439)"
10073,Northbound Pembina at Daly,60,54,800,"c(-97.1455277955284, 49.8684338351108)"
10076,Northbound Pembina at Scotland,60,54,800,"c(-97.1466533445161, 49.8659332479856)"
10077,Northbound Pembina at Grant,60,54,800,"c(-97.1472976471094, 49.8643694281962)"
10080,Northbound Pembina at Arbuthnot,60,54,800,"c(-97.1483100085065, 49.8626405873967)"
10082,Northbound Pembina at Jackson,60,54,800,"c(-97.1501355412721, 49.8596564335695)"
