stop_id,stop_name,route_id,n_departures,mean_headway,geometry
10083,Northbound Pembina at Taylor,60,54,800,"c(-97.1508938084818, 49.8583822564983)"
10085,Northbound Pembina at Stafford,60,54,800,"c(-97.1519802370413, 49.8565286354682)"
10595,Northbound Osborne at Assiniboine,60,54,800,"c(-97.1484559639911, 49.8832055927248)"
10596,Northbound Osborne at Broadway (Legislature),60,54,800,"c(-97.1494797663111, 49.885191874855)"
10607,Northbound Osborne at York,60,54,800,"c(-97.1497621052123, 49.8872742385423)"
10703,Northbound Vaughan at St. Mary,60,54,800,"c(-97.1482072939068, 49.8889764214999)"
10704,Northbound Vaughan at Graham (The Bay),60,54,800,"c(-97.1489874585091, 49.8904191070029)"
11034,Northbound Southwest Transitway at Jubilee Station,47,54,800,"c(-97.1496854327938, 49.8561411638201)"
11049,Northbound Southwest Transitway at Jubilee Overpass,47,54,800,"c(-97.150168653543, 49.8540530373511)"
40417,Southbound Henderson at Slater,11,54,800,"c(-97.0885597067226, 49.9429485283002)"
40418,Southbound Henderson at Edison,11,54,800,"c(-97.0897116717359, 49.9416632645097)"
60116,Northbound Pembina at Chancellor Matheson North,60,54,800,"c(-97.1565995209301, 49.8031264464806)"
60119,Eastbound Victoria Hospital at Victoria Hospital,60,54,800,"c(-97.1535354388635, 49.8065856908867)"
60120,Northbound Pembina at Dartmouth,60,54,800,"c(-97.1550856115542, 49.8060257352)"
60121,Northbound Pembina at Markham,60,54,800,"c(-97.1539444477614, 49.8082563164936)"
60126,Northbound Pembina at Southpark,60,54,800,"c(-97.1526550189273, 49.8107273875891)"
60127,Northbound Pembina at Chancellor,60,54,800,"c(-97.1513800334575, 49.8164639041935)"
60129,Northbound Pembina at Thatcher,60,54,800,"c(-97.1519482512225, 49.8132257416269)"
60132,Northbound Pembina at Thatcher North,60,54,800,"c(-97.1516108074888, 49.8147855031504)"
60140,Northbound Pembina at University Crescent,60,54,800,"c(-97.1516838653448, 49.8176111380037)"
60141,Northbound University at Pembina,47,54,800,"c(-97.1514965869536, 49.8181478534776)"
60146,Northbound Pembina at Plaza,47,54,800,"c(-97.1525734365335, 49.8227255737681)"
60147,Northbound Pembina at Adamar,47,54,800,"c(-97.1526491832392, 49.8240220788382)"
60149,Northbound Pembina at Adamar North,47,54,800,"c(-97.1523051694999, 49.8257526421566)"
60152,Northbound Pembina at Manahan South,47,54,800,"c(-97.1518079648562, 49.8282183560642)"
60153,Northbound Pembina at Manahan,47,54,800,"c(-97.1515278554715, 49.8293652551995)"
60156,Northbound Pembina at Chevrier,47,54,800,"c(-97.1507522720706, 49.8318355116396)"
60237,Northbound Pembina at Finch,47,54,800,"c(-97.1500426679804, 49.8343967680078)"
60240,Northbound Pembina at Fletcher,47,54,800,"c(-97.1504980998772, 49.836311007714)"
60240,Northbound Pembina at Fletcher,60,54,800,"c(-97.1504980998772, 49.836311007714)"
60242,Northbound Pembina at Waller,47,54,800,"c(-97.1517659782917, 49.8395335158423)"
60242,Northbound Pembina at Waller,60,54,800,"c(-97.1517659782917, 49.8395335158423)"
60245,Northbound Pembina at Oakenwald,47,54,800,"c(-97.1531301915807, 49.8413273268279)"
60245,Northbound Pembina at Oakenwald,60,54,800,"c(-97.1531301915807, 49.8413273268279)"
60247,Northbound Pembina at Riverwood,47,54,800,"c(-97.1531510505482, 49.8426049615173)"
60247,Northbound Pembina at Riverwood,60,54,800,"c(-97.1531510505482, 49.8426049615173)"
60250,Northbound Pembina at North Drive,47,54,800,"c(-97.1529123393764, 49.845218720333)"
60250,Northbound Pembina at North Drive,60,54,800,"c(-97.1529123393764, 49.845218720333)"
60253,Northbound Pembina at Point Road,47,54,800,"c(-97.1526524990405, 49.8480210370283)"
60253,Northbound Pembina at Point Road,60,54,800,"c(-97.1526524990405, 49.8480210370283)"
60257,Northbound Pembina at Calrossie,60,54,800,"c(-97.1525115012983, 49.8495299587968)"
60260,Northbound Pembina at Merriam,60,54,800,"c(-97.1522153114121, 49.8507305700258)"
40391,Northbound Henderson at Slater,11,53,815,"c(-97.0879504311634, 49.9431993236663)"
40392,Northbound Henderson at Sutton,11,53,815,"c(-97.0870594417039, 49.9442280268881)"
60097,Westbound Chancellor Matheson at Pembina,60,53,815,"c(-97.1559206451178, 49.8019732462503)"
60103,Northbound University at Chancellor Matheson,47,53,815,"c(-97.1396007948524, 49.807154046856)"
60103,Northbound University at Chancellor Matheson,BLUE,53,815,"c(-97.1396007948524, 49.807154046856)"
60105,Westbound Dafoe at Agriculture,47,53,815,"c(-97.1365298668843, 49.8067718075252)"
60105,Westbound Dafoe at Agriculture,60,53,815,"c(-97.1365298668843, 49.8067718075252)"
60105,Westbound Dafoe at Agriculture,BLUE,53,815,"c(-97.1365298668843, 49.8067718075252)"
60108,Northbound University at Dysart,47,53,815,"c(-97.1416167958128, 49.8096780986274)"
60109,Northbound University at Markham,47,53,815,"c(-97.1454885501983, 49.8120249834565)"
60111,Northbound University at Thatcher,47,53,815,"c(-97.1471539350615, 49.8153708657971)"
60114,Northbound University at Wedgewood,47,53,815,"c(-97.1494406408817, 49.8173773916276)"
60146,Northbound Pembina at Plaza,60,53,815,"c(-97.1525734365335, 49.8227255737681)"
60147,Northbound Pembina at Adamar,60,53,815,"c(-97.1526491832392, 49.8240220788382)"
60149,Northbound Pembina at Adamar North,60,53,815,"c(-97.1523051694999, 49.8257526421566)"
60152,Northbound Pembina at Manahan South,60,53,815,"c(-97.1518079648562, 49.8282183560642)"
60153,Northbound Pembina at Manahan,60,53,815,"c(-97.1515278554715, 49.8293652551995)"
60156,Northbound Pembina at Chevrier,60,53,815,"c(-97.1507522720706, 49.8318355116396)"
60237,Northbound Pembina at Finch,60,53,815,"c(-97.1500426679804, 49.8343967680078)"
60674,"Westbound Dafoe at U of M Station (36, 47, 60)",47,53,815,"c(-97.1303752534402, 49.8088673346328)"
60674,"Westbound Dafoe at U of M Station (36, 47, 60)",60,53,815,"c(-97.1303752534402, 49.8088673346328)"
60675,Westbound Dafoe at U of M Station (BLUE),BLUE,53,815,"c(-97.1314295402329, 49.8085605407252)"
61117,Westbound Dafoe at University,60,53,815,"c(-97.1396417020582, 49.8057244766533)"
61118,Westbound Dafoe at RH Way,60,53,815,"c(-97.1428537298955, 49.8045977142249)"
61119,Westbound Innovation at Research,60,53,815,"c(-97.1471265477358, 49.8029841275126)"
61120,Northbound Research at Chancellor Matheson,60,53,815,"c(-97.1492125406011, 49.8033143540547)"
61214,Westbound Southpark at Southpark Station,BLUE,53,815,"c(-97.1546493961781, 49.8105523239493)"
61255,Westbound Bohemier at University Crescent,BLUE,53,815,"c(-97.1423971181861, 49.8096276631384)"
20202,Westbound Portage at Woodlands,21,51,847,"c(-97.2808480558642, 49.8799402415845)"
20231,Westbound Portage at Country Club,21,51,847,"c(-97.2833262808079, 49.8803188190656)"
20232,Westbound Portage at Greenway,21,51,847,"c(-97.2863442788684, 49.8807862875956)"
20233,Westbound Portage at School,21,51,847,"c(-97.2900389897226, 49.881407591562)"
20234,Westbound Portage at Vimy,21,51,847,"c(-97.2918255179313, 49.881667829654)"
20235,Westbound Portage at Parkhill,21,51,847,"c(-97.2940689825835, 49.8819977375451)"
20236,Westbound Portage at Muriel,21,50,864,"c(-97.2960617228583, 49.8823329071842)"
30219,Westbound Jefferson at McGregor,18,50,864,"c(-97.1325324752774, 49.9379632500564)"
30223,Westbound Jefferson at McKenzie,18,50,864,"c(-97.1350518131772, 49.9387684252804)"
30225,Westbound Jefferson at Parr,18,50,864,"c(-97.1373232952937, 49.9394975986204)"
30375,Northbound McPhillips at Leila,18,50,864,"c(-97.1479673498831, 49.9526840078484)"
30376,Eastbound Leila at McPhillips,18,50,864,"c(-97.145653185163, 49.9526829554462)"
30379,Southbound Garden City Terminal at Garden City Centre (18),18,50,864,"c(-97.1456006685535, 49.95187257032)"
30386,Northbound McPhillips at Kingsbury,18,50,864,"c(-97.1492930995632, 49.9511940533861)"
30397,Northbound McPhillips at Kingsbury South,18,50,864,"c(-97.151012821928, 49.9492426380751)"
30398,Northbound McPhillips at Stardust,18,50,864,"c(-97.1528054975143, 49.9472024115383)"
30399,Westbound Jefferson at McPhillips East,18,50,864,"c(-97.1545314603996, 49.945080139654)"
30401,Westbound Jefferson at Tulip,18,50,864,"c(-97.1509944046863, 49.9438993503761)"
30402,Westbound Jefferson at Airlies West,18,50,864,"c(-97.1476212307626, 49.9428110227914)"
30411,Westbound Jefferson at Airlies East,18,50,864,"c(-97.1459554231447, 49.9422716518704)"
30412,Westbound Jefferson at Sinclair,18,50,864,"c(-97.1432291975746, 49.9414004349541)"
30413,Westbound Jefferson at Teakwood,18,50,864,"c(-97.1403790963082, 49.9404911839525)"
30041,Westbound Jefferson at Main,18,49,882,"c(-97.120791783305, 49.9341753119328)"
30108,Westbound Jefferson at Aikins,18,49,882,"c(-97.1225120326755, 49.9347339220712)"
30139,Westbound Jefferson at Salter,18,49,882,"c(-97.1248795748724, 49.9354918850252)"
30185,Westbound Jefferson at Powers,18,49,882,"c(-97.127425810983, 49.9363156537624)"
30187,Westbound Jefferson at Andrews,18,49,882,"c(-97.1306055088348, 49.9373384887349)"
